{
  "schema_version": "city-answer-summary-batch-decisions.v1",
  "session": "令和8年第4回定例会",
  "diet_session_slug": "ishigaki-r8-dai4-teireikai",
  "artifact_type": "city_answer_summary_batch_decisions",
  "artifact_origin": "hand_authored_reviewer_decision",
  "review_status": "reviewer_only",
  "batch": {
    "batch_id": "city-answer-summaries-batch-2",
    "reviewed_at": "2026-07-17T00:00:00+09:00",
    "reviewed_from_commit": "d57e8eb408ca9ddb2a43389fc777e1950d589caf"
  },
  "sources": {
    "general_questions": "../../general_questions/r8-dai4-teireikai.general-questions.json",
    "candidate_inventory": "../candidate-inventory/r8-dai4-teireikai.candidate-inventory.json",
    "utterance_index": "../utterance-index/r8-dai4-teireikai.utterances.json",
    "answer_summary_candidates": "../answer-summary-candidates/r8-dai4-teireikai.answer-summary-candidates.json",
    "answer_summary_final_decisions": "r8-dai4-teireikai.answer-summary-final-decisions.json"
  },
  "summary": {
    "candidate_total": 8,
    "approve_as_written_total": 0,
    "approve_with_revision_total": 3,
    "hold_total": 3,
    "reject_total": 2,
    "selected_for_batch_total": 3,
    "selected_final_summary_total": 3,
    "batch_1_overlap_total": 0,
    "confirmed_fact_duplicate_total": 0,
    "duplicate_selected_summary_total": 0,
    "empty_final_summary_total": 0,
    "public_json_changed": false,
    "production_import_executed": false,
    "revalidation_executed": false
  },
  "selection_policy": {
    "target": "High-confidence city/executive answer summaries that help citizens understand the city's answer and are not already covered by Batch 1 summaries or confirmed_facts.",
    "excluded": [
      "speaker attribution risk",
      "item mismatch risk",
      "ASR or OCR noise in key names or places",
      "confirmed_fact-only numerical fragments",
      "generic policy posture without enough item-specific substance",
      "Batch 1 semantic duplicates"
    ]
  },
  "candidates": [
    {
      "decision_id": "city-answer-summaries-batch-2::ishigaki-r8-dai4-ippan-tomoyose-eizo.item06::ishigaki-r8-dai4-teireikai.gq.ishigaki-r8-dai4-ippan-tomoyose-eizo.u0013",
      "candidate_id": "ishigaki-r8-dai4-ippan-tomoyose-eizo.item06::ishigaki-r8-dai4-teireikai.gq.ishigaki-r8-dai4-ippan-tomoyose-eizo.u0013::direct_item_match",
      "question_id": "ishigaki-r8-dai4-ippan-tomoyose-eizo",
      "council_member": "友寄永三",
      "item_number": 6,
      "item_title": "バスケットコート設置について",
      "source_utterance_id": "ishigaki-r8-dai4-teireikai.gq.ishigaki-r8-dai4-ippan-tomoyose-eizo.u0013",
      "source_speaker": "建設部長 下地俊幸",
      "source_speaker_role": "executive",
      "source_location": "docs/general_questions_minutes/utterance-index/r8-dai4-teireikai.utterances.json L151-L155",
      "source_excerpt": "バスケットコートについては、船倉公園において、市役市まちづくり支援寄付金活用事業を導入し、整備に取り組んでおります。本年4月には実施設計業務委託を発注し、7月末までの完了予定となっており、作業を進めております。",
      "surrounding_context": "友寄永三 item 6 の進捗状況への市側答弁。寄付金活用事業、実施設計、工事着手、年度内完成の見通しを説明している。",
      "candidate_summary": "バスケットコート設置について、市は市まちづくり支援寄付金活用事業を用いて整備を進めており、2026年4月に実施設計業務を発注し、実施設計完了後に工事へ着手して2026年度内の完成を目指すとしている。",
      "final_summary": "バスケットコート設置について、市は市まちづくり支援寄付金活用事業を用いて整備を進めており、2026年4月に実施設計業務を発注し、実施設計完了後に工事へ着手して2026年度内の完成を目指すとしている。",
      "decision": "approve_with_revision",
      "selected_for_batch_2": true,
      "attribution_confidence": "high",
      "item_match_confidence": "high",
      "source_confidence": "high",
      "confirmed_fact_overlap": "none",
      "batch_1_overlap": "none",
      "duplicate_check": "none",
      "risk_flags": [
        "source_contains_possible_park_name_asr_variant",
        "future_completion_is_plan_not_completed_fact"
      ],
      "rationale": "sourceは市側答弁で、item 6に直接対応している。公園名にASR揺れの可能性があるためfinal summaryでは公園名を使わず、整備状況と年度内完成を目指すという答弁要旨に限定した。",
      "rejection_or_hold_reason": null
    },
    {
      "decision_id": "city-answer-summaries-batch-2::ishigaki-r8-dai4-ippan-omichi-natsuyo.item05::ishigaki-r8-dai4-teireikai.gq.ishigaki-r8-dai4-ippan-omichi-natsuyo.u0009",
      "candidate_id": "ishigaki-r8-dai4-ippan-omichi-natsuyo.item05::ishigaki-r8-dai4-teireikai.gq.ishigaki-r8-dai4-ippan-omichi-natsuyo.u0009::direct_item_match",
      "question_id": "ishigaki-r8-dai4-ippan-omichi-natsuyo",
      "council_member": "大道夏代",
      "item_number": 5,
      "item_title": "観光地におけるバリアフリー環境整備について",
      "source_utterance_id": "ishigaki-r8-dai4-teireikai.gq.ishigaki-r8-dai4-ippan-omichi-natsuyo.u0009",
      "source_speaker": "農林水産商工部長 米森博文",
      "source_speaker_role": "executive",
      "source_location": "docs/general_questions_minutes/utterance-index/r8-dai4-teireikai.utterances.json L188-L203",
      "source_excerpt": "現在、夕暮れなモールにはバリアフリートイレが2カ所あり、石垣市公設市場内の1カ所、石垣市町中交流館・雲卓屋に1カ所設置されております。このうち、石垣市公設市場内のバリアフリートイレに設置されているオスメイト対応設備につきましては、故障により使用できない状態となっており、本市としましては、この状況を認識しており、現在、関係者と連携しながら修繕に向けた調整を進めているところであります。",
      "surrounding_context": "大道夏代 item 5 のユーグレナモールのバリアフリートイレ現状認識と利用環境改善への市側答弁。",
      "candidate_summary": "ユーグレナモールのバリアフリートイレについて、市は2か所設置されていると説明し、公設市場内設備の一部故障については関係者と修繕に向けた調整を進めているとしている。",
      "final_summary": "ユーグレナモールのバリアフリートイレについて、市は2か所設置されていると説明し、公設市場内設備の一部故障については関係者と修繕に向けた調整を進めているとしている。",
      "decision": "approve_with_revision",
      "selected_for_batch_2": true,
      "attribution_confidence": "high",
      "item_match_confidence": "high",
      "source_confidence": "high",
      "confirmed_fact_overlap": "none",
      "batch_1_overlap": "none",
      "duplicate_check": "none",
      "risk_flags": [
        "source_contains_facility_name_asr_variants",
        "summary_avoids_uncertain_facility_subname"
      ],
      "rationale": "sourceは市側答弁で、item titleと直接対応している。sourceの施設名細部にASR揺れがあるため、final summaryではユーグレナモール、公設市場内設備、修繕調整という確認可能な範囲に絞った。",
      "rejection_or_hold_reason": null
    },
    {
      "decision_id": "city-answer-summaries-batch-2::ishigaki-r8-dai4-ippan-nakamine-tadashi.item05::ishigaki-r8-dai4-teireikai.gq.ishigaki-r8-dai4-ippan-nakamine-tadashi.u0010",
      "candidate_id": "ishigaki-r8-dai4-ippan-nakamine-tadashi.item05::ishigaki-r8-dai4-teireikai.gq.ishigaki-r8-dai4-ippan-nakamine-tadashi.u0010::direct_item_match",
      "question_id": "ishigaki-r8-dai4-ippan-nakamine-tadashi",
      "council_member": "仲嶺忠師",
      "item_number": 5,
      "item_title": "ハーリー広場整備について",
      "source_utterance_id": "ishigaki-r8-dai4-teireikai.gq.ishigaki-r8-dai4-ippan-nakamine-tadashi.u0010",
      "source_speaker": "農林水産商工部長 米森博文",
      "source_speaker_role": "executive",
      "source_location": "docs/general_questions_minutes/utterance-index/r8-dai4-teireikai.utterances.json L106-L112",
      "source_excerpt": "ハーディ広場の遊具につきましては 既存遊具の経年劣化による老朽化や腐食が進行し 修繕による対応が困難であることから 昨年度撤去を行ったところであります。議員ご指摘のとおり新たな遊具設置につきましては現在近隣の子ども園を対象にアンケート調査を実施しております。",
      "surrounding_context": "仲嶺忠師 item 5 のハーリー広場遊具設置に関する市側答弁。既存遊具撤去、新規遊具設置に向けた調査、補助事業活用調整を説明している。",
      "candidate_summary": "ハーリー広場の遊具について、市は既存遊具を老朽化・腐食により撤去済みで、近隣の子ども園へのアンケート結果を踏まえ、新たな遊具設置と補助事業活用に向けて調整を進めているとしている。",
      "final_summary": "ハーリー広場の遊具について、市は既存遊具を老朽化・腐食により撤去済みで、近隣の子ども園へのアンケート結果を踏まえ、新たな遊具設置と補助事業活用に向けて調整を進めているとしている。",
      "decision": "approve_with_revision",
      "selected_for_batch_2": true,
      "attribution_confidence": "high",
      "item_match_confidence": "high",
      "source_confidence": "high",
      "confirmed_fact_overlap": "none",
      "batch_1_overlap": "none",
      "duplicate_check": "none",
      "risk_flags": [
        "source_contains_hari_name_asr_variant",
        "future_installation_not_completed_fact"
      ],
      "rationale": "sourceは市側答弁で、item 5に直接対応している。sourceの『ハーディ』はASR揺れと判断されるため、public sourceのitem titleに合わせたハーリー広場表記を用い、実施済み撤去と今後の設置調整を区別して要約した。",
      "rejection_or_hold_reason": null
    },
    {
      "decision_id": "city-answer-summaries-batch-2::ishigaki-r8-dai4-ippan-nagahama-nobuo.item02::ishigaki-r8-dai4-teireikai.gq.ishigaki-r8-dai4-ippan-nagahama-nobuo.u0008",
      "candidate_id": "ishigaki-r8-dai4-ippan-nagahama-nobuo.item02::ishigaki-r8-dai4-teireikai.gq.ishigaki-r8-dai4-ippan-nagahama-nobuo.u0008::direct_item_match",
      "question_id": "ishigaki-r8-dai4-ippan-nagahama-nobuo",
      "council_member": "長浜信夫",
      "item_number": 2,
      "item_title": "物価高騰対策について",
      "source_utterance_id": "ishigaki-r8-dai4-teireikai.gq.ishigaki-r8-dai4-ippan-nagahama-nobuo.u0008",
      "source_speaker": "市民保健部長 富浜",
      "source_speaker_role": "executive",
      "source_location": "docs/general_questions_minutes/utterance-index/r8-dai4-teireikai.utterances.json L104-L125",
      "source_excerpt": "本市においてはこれまでも国の物価高騰対応重点支援地方創生臨時交付金を活用して様々な支援策を展開してきました。今年度においても給食費減免事業に取り組んでいるところですが、去る6月5日に本交付金1000億円が計上された国の令和8年度補正予算が成立し、本市における交付限度額として2755万7000円が示されたところです。",
      "surrounding_context": "長浜信夫 item 2 の物価高騰対策への市側答弁。過年度支援、今年度給食費減免、補正予算に基づく今後の支援策検討を説明している。",
      "candidate_summary": null,
      "final_summary": null,
      "decision": "hold",
      "selected_for_batch_2": false,
      "attribution_confidence": "high",
      "item_match_confidence": "high",
      "source_confidence": "high",
      "confirmed_fact_overlap": "none",
      "batch_1_overlap": "none",
      "duplicate_check": "none",
      "risk_flags": [
        "multi_part_answer",
        "needs_wording_scope_decision"
      ],
      "rationale": "市側答弁としては有用だが、過年度施策、今年度施策、国補正予算、今後検討を1文にまとめると過密になる。Batch 2では採用せず、必要なら別途summary分割を検討する。",
      "rejection_or_hold_reason": "scope_too_broad_for_current_batch"
    },
    {
      "decision_id": "city-answer-summaries-batch-2::ishigaki-r8-dai4-ippan-shinzato-yuki.item06::ishigaki-r8-dai4-teireikai.gq.ishigaki-r8-dai4-ippan-shinzato-yuki.u0014",
      "candidate_id": "ishigaki-r8-dai4-ippan-shinzato-yuki.item06::ishigaki-r8-dai4-teireikai.gq.ishigaki-r8-dai4-ippan-shinzato-yuki.u0014::direct_item_match",
      "question_id": "ishigaki-r8-dai4-ippan-shinzato-yuki",
      "council_member": "新里裕樹",
      "item_number": 6,
      "item_title": "地域産業を支える人材確保と島外人材の呼び込みについて",